<?xml version="1.0" encoding="UTF-8"?>

<!ELEMENT config (dao, params*)>

<!ELEMENT dao (userParams*)>
<!ATTLIST dao
class CDATA #REQUIRED>

<!ELEMENT userParams (param*)>
<!ATTLIST userParams
name CDATA #REQUIRED>

<!ELEMENT params (param*)>
<!ELEMENT param (#PCDATA)>
<!ATTLIST param
name CDATA #REQUIRED>